{
  "format": "gdd-report/0.2",
  "tool": {
    "name": "gdd-validator",
    "version": "0.6.0"
  },
  "spec_revision": "sha256:ef2bbd384bb74078fbda12442351c7ba74cf8c140ea150d39bf7f2ed24b7dc16",
  "profiles": [
    "records"
  ],
  "scope": [],
  "checks": [
    {
      "check_id": "representation.schema",
      "dimension": "model",
      "result": "PASS",
      "scope": [],
      "reason": "Local JSON Schema validation.",
      "diagnostics": []
    },
    {
      "check_id": "representation.schema",
      "dimension": "model",
      "result": "PASS",
      "scope": [],
      "reason": "Local JSON Schema validation.",
      "diagnostics": []
    },
    {
      "check_id": "model.semantics",
      "dimension": "model",
      "result": "PASS",
      "scope": [],
      "reason": "Core references, endpoints, identity, refinement, machines, types and declared extension data checked.",
      "diagnostics": []
    },
    {
      "check_id": "records.integrity",
      "dimension": "model",
      "result": "PASS",
      "scope": [],
      "reason": "Record identities, references, supersession and current snapshot scopes checked.",
      "diagnostics": []
    },
    {
      "check_id": "implementation.required.0",
      "dimension": "implementation",
      "result": "PASS",
      "scope": [
        "rule.no_cli_tariffs"
      ],
      "reason": "Applicability of recorded rule.no_cli_tariffs/architecture.python_ast; application check not executed by validator.",
      "diagnostics": [],
      "implementation": "implementation.parcel",
      "code_revision": "sha256:b0e8527e09cc538203aaa7c8c9c977ac5de6205d4bb0e1de188368b247e89970",
      "evidence_refs": [
        "evidence.architecture.b"
      ]
    },
    {
      "check_id": "implementation.required.1",
      "dimension": "implementation",
      "result": "PASS",
      "scope": [
        "rule.price"
      ],
      "reason": "Applicability of recorded rule.price/behavior.unittest; application check not executed by validator.",
      "diagnostics": [],
      "implementation": "implementation.parcel",
      "code_revision": "sha256:b0e8527e09cc538203aaa7c8c9c977ac5de6205d4bb0e1de188368b247e89970",
      "evidence_refs": [
        "evidence.behavior.b"
      ]
    }
  ]
}
