{
  "format": "gdd-report/0.2",
  "tool": {
    "name": "gdd-validator",
    "version": "0.6.0"
  },
  "spec_revision": "sha256:6e63e184d19f87e79056d66d9922c3d7dbbd62db481f50e59d5f194fbe7d1ab9",
  "profiles": [
    "model",
    "readiness"
  ],
  "scope": [
    "action.cancel",
    "action.catalog",
    "action.current_session",
    "action.list_own_reservations",
    "action.login",
    "action.logout",
    "action.reserve",
    "component.api",
    "screen.reserve"
  ],
  "checks": [
    {
      "check_id": "representation.schema",
      "dimension": "model",
      "result": "PASS",
      "scope": [],
      "reason": "Local JSON Schema validation.",
      "diagnostics": []
    },
    {
      "check_id": "representation.schema",
      "dimension": "model",
      "result": "PASS",
      "scope": [],
      "reason": "Local JSON Schema validation.",
      "diagnostics": []
    },
    {
      "check_id": "model.semantics",
      "dimension": "model",
      "result": "PASS",
      "scope": [],
      "reason": "Core references, endpoints, identity, refinement, machines, types and declared extension data checked.",
      "diagnostics": []
    },
    {
      "check_id": "records.integrity",
      "dimension": "model",
      "result": "PASS",
      "scope": [],
      "reason": "Record identities, references, supersession and current snapshot scopes checked.",
      "diagnostics": []
    },
    {
      "check_id": "package.backend.context.package",
      "dimension": "readiness",
      "result": "PASS",
      "scope": [
        "action.cancel",
        "action.catalog",
        "action.list_own_reservations",
        "action.reserve"
      ],
      "reason": "Candidate work package compared with fixed-point closure.",
      "diagnostics": []
    },
    {
      "check_id": "package.backend.readiness.structural",
      "dimension": "readiness",
      "result": "PASS",
      "scope": [
        "action.cancel",
        "action.catalog",
        "action.list_own_reservations",
        "action.reserve"
      ],
      "reason": "Selected targets and required boundary contracts are structurally specified; no behavioral proof claimed.",
      "diagnostics": []
    },
    {
      "check_id": "package.backend.ownership",
      "dimension": "readiness",
      "result": "PASS",
      "scope": [
        "action.cancel",
        "action.catalog",
        "action.list_own_reservations",
        "action.reserve"
      ],
      "reason": "Explicit logical file ownership and workspace declarations; actual isolation must be verified by the host.",
      "diagnostics": []
    },
    {
      "check_id": "package.frontend.context.package",
      "dimension": "readiness",
      "result": "PASS",
      "scope": [
        "screen.reserve"
      ],
      "reason": "Candidate work package compared with fixed-point closure.",
      "diagnostics": []
    },
    {
      "check_id": "package.frontend.readiness.structural",
      "dimension": "readiness",
      "result": "PASS",
      "scope": [
        "screen.reserve"
      ],
      "reason": "Selected targets and required boundary contracts are structurally specified; no behavioral proof claimed.",
      "diagnostics": []
    },
    {
      "check_id": "package.frontend.ownership",
      "dimension": "readiness",
      "result": "PASS",
      "scope": [
        "screen.reserve"
      ],
      "reason": "Explicit logical file ownership and workspace declarations; actual isolation must be verified by the host.",
      "diagnostics": []
    },
    {
      "check_id": "package.transport.context.package",
      "dimension": "readiness",
      "result": "PASS",
      "scope": [
        "action.current_session",
        "action.login",
        "action.logout",
        "component.api"
      ],
      "reason": "Candidate work package compared with fixed-point closure.",
      "diagnostics": []
    },
    {
      "check_id": "package.transport.readiness.structural",
      "dimension": "readiness",
      "result": "PASS",
      "scope": [
        "action.current_session",
        "action.login",
        "action.logout",
        "component.api"
      ],
      "reason": "Selected targets and required boundary contracts are structurally specified; no behavioral proof claimed.",
      "diagnostics": []
    },
    {
      "check_id": "package.transport.ownership",
      "dimension": "readiness",
      "result": "PASS",
      "scope": [
        "action.current_session",
        "action.login",
        "action.logout",
        "component.api"
      ],
      "reason": "Explicit logical file ownership and workspace declarations; actual isolation must be verified by the host.",
      "diagnostics": []
    },
    {
      "check_id": "workflow.check_plans",
      "dimension": "readiness",
      "result": "PASS",
      "scope": [
        "action.cancel",
        "action.catalog",
        "action.current_session",
        "action.list_own_reservations",
        "action.login",
        "action.logout",
        "action.reserve",
        "component.api",
        "screen.reserve"
      ],
      "reason": "Selected active checks must cover every blocking rule and method.",
      "diagnostics": []
    },
    {
      "check_id": "parallel.independence",
      "dimension": "readiness",
      "result": "PASS",
      "scope": [
        "action.cancel",
        "action.catalog",
        "action.current_session",
        "action.list_own_reservations",
        "action.login",
        "action.logout",
        "action.reserve",
        "component.api",
        "screen.reserve"
      ],
      "reason": "Declared write resources, effects, revisions and integration plans checked; runtime safety is not proven.",
      "diagnostics": []
    }
  ]
}
