{
  "format": "gdd-report/0.2",
  "tool": {
    "name": "gdd-validator",
    "version": "0.6.0"
  },
  "spec_revision": "sha256:ef2bbd384bb74078fbda12442351c7ba74cf8c140ea150d39bf7f2ed24b7dc16",
  "profiles": [
    "model",
    "readiness"
  ],
  "scope": [
    "action.cli",
    "action.quote",
    "action.rate"
  ],
  "checks": [
    {
      "check_id": "representation.schema",
      "dimension": "model",
      "result": "PASS",
      "scope": [],
      "reason": "Local JSON Schema validation.",
      "diagnostics": []
    },
    {
      "check_id": "representation.schema",
      "dimension": "model",
      "result": "PASS",
      "scope": [],
      "reason": "Local JSON Schema validation.",
      "diagnostics": []
    },
    {
      "check_id": "model.semantics",
      "dimension": "model",
      "result": "PASS",
      "scope": [],
      "reason": "Core references, endpoints, identity, refinement, machines, types and declared extension data checked.",
      "diagnostics": []
    },
    {
      "check_id": "records.integrity",
      "dimension": "model",
      "result": "PASS",
      "scope": [],
      "reason": "Record identities, references, supersession and current snapshot scopes checked.",
      "diagnostics": []
    },
    {
      "check_id": "package.parcel.b.context.package",
      "dimension": "readiness",
      "result": "PASS",
      "scope": [
        "action.cli",
        "action.quote",
        "action.rate"
      ],
      "reason": "Candidate work package compared with fixed-point closure.",
      "diagnostics": []
    },
    {
      "check_id": "package.parcel.b.readiness.structural",
      "dimension": "readiness",
      "result": "PASS",
      "scope": [
        "action.cli",
        "action.quote",
        "action.rate"
      ],
      "reason": "Selected targets and required boundary contracts are structurally specified; no behavioral proof claimed.",
      "diagnostics": []
    },
    {
      "check_id": "package.parcel.b.ownership",
      "dimension": "readiness",
      "result": "PASS",
      "scope": [
        "action.cli",
        "action.quote",
        "action.rate"
      ],
      "reason": "Explicit logical file ownership and workspace declarations; actual isolation must be verified by the host.",
      "diagnostics": []
    },
    {
      "check_id": "workflow.check_plans",
      "dimension": "readiness",
      "result": "PASS",
      "scope": [
        "action.cli",
        "action.quote",
        "action.rate"
      ],
      "reason": "Selected active checks must cover every blocking rule and method.",
      "diagnostics": []
    },
    {
      "check_id": "workflow.packet_integrity",
      "dimension": "readiness",
      "result": "PASS",
      "scope": [
        "action.cli",
        "action.quote",
        "action.rate"
      ],
      "reason": "Complete packet must match the current model, assets, selected check declarations and original request.",
      "diagnostics": []
    }
  ]
}
