{
  "format": "gdd-report/0.2",
  "tool": {
    "name": "gdd-validator",
    "version": "0.7.0"
  },
  "spec_revision": "sha256:fee6a315acc673e367d0a65c32ec8d2aa59e002ee76b33700e764162ca8fc62f",
  "profiles": [
    "readiness"
  ],
  "scope": [
    "component.reservations"
  ],
  "checks": [
    {
      "check_id": "representation.schema",
      "dimension": "model",
      "result": "PASS",
      "scope": [],
      "reason": "Local JSON Schema validation.",
      "diagnostics": []
    },
    {
      "check_id": "representation.schema",
      "dimension": "model",
      "result": "PASS",
      "scope": [],
      "reason": "Local JSON Schema validation.",
      "diagnostics": []
    },
    {
      "check_id": "model.semantics",
      "dimension": "model",
      "result": "PASS",
      "scope": [],
      "reason": "Core references, endpoints, identity, refinement, machines, types and declared extension data checked.",
      "diagnostics": []
    },
    {
      "check_id": "check.revision_unresolved",
      "dimension": "model",
      "result": "UNKNOWN",
      "scope": [],
      "reason": "Historical snapshot unavailable for decision.adopt-lifecycle; targets not rebound to current model.",
      "diagnostics": [
        {
          "code": "REVISION_UNRESOLVED",
          "severity": "warning",
          "message": "Historical snapshot unavailable for decision.adopt-lifecycle; targets not rebound to current model.",
          "location": {
            "file": null,
            "pointer": ""
          },
          "related_ids": [
            "decision.adopt-lifecycle"
          ]
        }
      ]
    },
    {
      "check_id": "check.revision_unresolved",
      "dimension": "model",
      "result": "UNKNOWN",
      "scope": [],
      "reason": "Historical snapshot unavailable for check.lifecycle; targets not rebound to current model.",
      "diagnostics": [
        {
          "code": "REVISION_UNRESOLVED",
          "severity": "warning",
          "message": "Historical snapshot unavailable for check.lifecycle; targets not rebound to current model.",
          "location": {
            "file": null,
            "pointer": ""
          },
          "related_ids": [
            "check.lifecycle"
          ]
        }
      ]
    },
    {
      "check_id": "check.revision_unresolved",
      "dimension": "model",
      "result": "UNKNOWN",
      "scope": [],
      "reason": "Historical snapshot unavailable for decision.adopt-lifecycle.v2; targets not rebound to current model.",
      "diagnostics": [
        {
          "code": "REVISION_UNRESOLVED",
          "severity": "warning",
          "message": "Historical snapshot unavailable for decision.adopt-lifecycle.v2; targets not rebound to current model.",
          "location": {
            "file": null,
            "pointer": ""
          },
          "related_ids": [
            "decision.adopt-lifecycle.v2"
          ]
        }
      ]
    },
    {
      "check_id": "check.revision_unresolved",
      "dimension": "model",
      "result": "UNKNOWN",
      "scope": [],
      "reason": "Historical snapshot unavailable for check.lifecycle.v2; targets not rebound to current model.",
      "diagnostics": [
        {
          "code": "REVISION_UNRESOLVED",
          "severity": "warning",
          "message": "Historical snapshot unavailable for check.lifecycle.v2; targets not rebound to current model.",
          "location": {
            "file": null,
            "pointer": ""
          },
          "related_ids": [
            "check.lifecycle.v2"
          ]
        }
      ]
    },
    {
      "check_id": "context.package",
      "dimension": "readiness",
      "result": "PASS",
      "scope": [
        "component.reservations"
      ],
      "reason": "Candidate work package compared with fixed-point closure.",
      "diagnostics": []
    },
    {
      "check_id": "readiness.structural",
      "dimension": "readiness",
      "result": "PASS",
      "scope": [
        "component.reservations"
      ],
      "reason": "Selected targets and required boundary contracts are structurally specified; no behavioral proof claimed.",
      "diagnostics": []
    }
  ]
}
