{
  "format": "gdd-report/0.2",
  "tool": {
    "name": "gdd-validator",
    "version": "0.2.0"
  },
  "spec_revision": "sha256:68cef3a59791ebf866c4fd601aca5e2e70a23716b95ee4989e7bd3efd75e6210",
  "profiles": [
    "records"
  ],
  "scope": [
    "action.reserve"
  ],
  "checks": [
    {
      "check_id": "representation.schema",
      "dimension": "model",
      "result": "PASS",
      "scope": [],
      "reason": "Local JSON Schema validation.",
      "diagnostics": []
    },
    {
      "check_id": "representation.schema",
      "dimension": "model",
      "result": "PASS",
      "scope": [],
      "reason": "Local JSON Schema validation.",
      "diagnostics": []
    },
    {
      "check_id": "model.semantics",
      "dimension": "model",
      "result": "PASS",
      "scope": [],
      "reason": "Core references, endpoints, identity, refinement, machines, types and declared extension data checked.",
      "diagnostics": []
    },
    {
      "check_id": "records.integrity",
      "dimension": "model",
      "result": "PASS",
      "scope": [],
      "reason": "Record identities, references, supersession and current snapshot scopes checked.",
      "diagnostics": []
    },
    {
      "check_id": "authorization.activity",
      "dimension": "authorization",
      "result": "UNRESOLVED",
      "scope": [
        "action.reserve"
      ],
      "reason": "No applicable host-trusted policy and actor authority.",
      "diagnostics": [
        {
          "code": "AUTHORIZATION_UNRESOLVED",
          "severity": "warning",
          "message": "No applicable host-trusted policy and actor authority.",
          "location": {
            "file": null,
            "pointer": ""
          },
          "related_ids": []
        }
      ],
      "activity": "implementation"
    }
  ]
}
